<?xml version="1.0" encoding="utf-8"?>
<!DOCTYPE configuration SYSTEM "objects.dtd">

<configuration>

	<objectTypes>
		<objectType name="article" contentType="document" allowDelete="true" >
			<elements>
				<text name="multilineIPE" label="MultiLine IPE" isMultiline="true"/>
				<text name="multilineIPE2" label="MultiLine IPE" isMultiline="true"/>
				<text name="multilineIPE3" label="MultiLine IPE" isMultiline="true"/>
				<text name="multilineIPE4" label="MultiLine IPE" isMultiline="true"/>
				<text name="multilineIPE5" label="MultiLine IPE" isMultiline="true"/>
				<text name="multilineIPE6" label="MultiLine IPE" isMultiline="true"/>
			</elements>
		</objectType>


		<objectType name="category" contentType="category" allowChildSort="false" allowDelete="false" allowTogglePublish="false">
			<addableObject objectTypeName="article" addText="Add an Article" />
		</objectType>
		
	</objectTypes>

</configuration>
